{
  "format": "tw.admission-decision/0.1",
  "origin_id": "api-worldbank-org",
  "review_state": "completed",
  "admit_to_registry": true,
  "reviewer_type": "human",
  "approval_reference": "reports/futo-policy-decision-proposals.md",
  "catalog_reviewed_at": "2026-08-10T00:00:00Z",
  "catalog_reviewer": "Genesis steward",
  "policy_review_state": "completed",
  "policy_decision": "permit_with_constraints",
  "policy_reviewed_at": "2026-08-11T12:15:50Z",
  "policy_reviewer": "Richi (Genesis steward)",
  "rationale": "The official public Indicators API route already admitted by E2 is approved for bounded, cached and attributed public-read use. The missing robots resource is recorded as unavailable and does not itself grant authority.",
  "constraints": [
    "Identify TWIRX, preserve World Bank attribution and obey published limits.",
    "No authentication, broad crawl, browser, model, payment or write action is authorized.",
    "Only the documented E2 country, indicator and year route is permitted.",
    "The Atlas scheduler remains disabled for the FUTO release."
  ],
  "evidence_refs": [
    "reports/futo-policy-decision-proposals.md",
    "reports/gate-e2-live-provenance-lab.md"
  ]
}
